{
  "$schema": "http://json-schema.org/draft-07/schema#",
  "$id": "https://obsidian.dev/skills/micp-ureolysis-chemistry/input.schema.json",
  "title": "micp-ureolysis-chemistry input envelope",
  "description": "Envelope passed by the Obsidian controller when invoking the skill. Follows the Obsidian Plan project convention (see obsidian-mission-lock schemas). Version 1.0.0.",
  "type": "object",
  "required": ["task_id", "project_id", "request", "skill_version", "timestamp"],
  "additionalProperties": false,
  "properties": {
    "task_id": { "type": "string", "minLength": 1, "description": "Unique task identifier (UUID/ULID), generated by the controller" },
    "project_id": { "type": "string", "minLength": 1 },
    "request": { "type": "string", "minLength": 1, "description": "Verbatim natural-language user request" },
    "context": {
      "type": "object",
      "description": "Free-form context. Reserved keys: pathway, matrix, draft_calc, simulation (a full simulate params object), species (a species snapshot), evidence",
      "properties": {
        "pathway": { "type": "string", "enum": ["ureolysis", "denitrification", "eicp", "other"], "description": "MICP pathway. This skill models UREOLYSIS only; non-urea pathways must not reuse this model (returns BLOCKED / NEED_ADDITIONAL_SKILL otherwise)" },
        "matrix": { "type": "string", "description": "Porous-medium type: sand / clay / rock fracture / concrete / batch" },
        "draft_calc": { "type": "object", "description": "A draft calculation result object for programmatic re-checking" },
        "simulation": { "type": "object", "description": "Full simulate_batch params for direct tool dispatch" },
        "species": { "type": "object", "description": "Species -> mol/L snapshot for conservation checks" }
      },
      "additionalProperties": true
    },
    "constraints": { "type": "object", "description": "Named constraints, values string|number|boolean" },
    "evidence_refs": { "type": "array", "items": { "type": "string" }, "description": "URIs/paths/DOIs of evidence the calculation may cite" },
    "data_refs": { "type": "array", "items": { "type": "string" }, "description": "URIs/paths of input data (e.g. time-series CSV for fitting)" },
    "upstream_outputs": { "type": "array", "items": true, "description": "Outputs from previously run skills" },
    "requested_output_format": { "type": "string", "enum": ["json", "yaml", "markdown"], "default": "json" },
    "risk_level": { "type": "string", "enum": ["low", "medium", "high", "critical"], "default": "low" },
    "human_approval_state": { "type": "string", "enum": ["not_required", "pending", "approved", "rejected"], "default": "not_required" },
    "skill_version": { "type": "string", "pattern": "^\\d+\\.\\d+\\.\\d+$", "description": "Skill version the caller expects; cross-major mismatch without migration is rejected (MUC-E1010)" },
    "controller_version": { "type": "string" },
    "timestamp": { "type": "string", "format": "date-time" },
    "tool": { "type": "string", "enum": ["balance", "speciate", "simulate", "fit", "sens", "units", "phreeqc-in", "phreeqc-run", "validate", "version"], "description": "Direct machine dispatch: run the named CLI tool with params. When omitted, the LLM layer interprets request and dispatches." },
    "params": { "type": "object", "description": "Params passed to the dispatched tool (only valid with tool set)" }
  }
}
